question,course,document
What is the solution to the scipy module error provided by Erick Calderin?,machine-learning-zoomcamp,e7af4968
How does flow_from_directory determine numeric class labels when using binary class mode?,machine-learning-zoomcamp,9fad096e
In what order are folders read by the flow_from_directory method?,machine-learning-zoomcamp,9fad096e
What value does a binary Keras model predict with a sigmoid activation function?,machine-learning-zoomcamp,9fad096e
How can you calculate the probability of class 0 from a Keras model prediction?,machine-learning-zoomcamp,9fad096e
What does a prediction of 0.8 from a Keras model using sigmoid activation indicate?,machine-learning-zoomcamp,9fad096e
Do the predicted values from a neural network need to exactly match actual values or serve as likelihood indicators?,machine-learning-zoomcamp,bcdf7407
Are exact predicted values crucial for neural network outcomes or are small variations acceptable?,machine-learning-zoomcamp,bcdf7407
Should we interpret neural network predictions as exact outcomes or as probabilities with minor expected changes?,machine-learning-zoomcamp,bcdf7407
"Is it necessary for neural network predictions to be precise, or can they be viewed as probable outcomes with slight variations?",machine-learning-zoomcamp,bcdf7407
"When using neural networks, should we expect predicted values to align with actual values or accept them with some fluctuations?",machine-learning-zoomcamp,bcdf7407
What should you do if the reported accuracy of your wasp/bee model differs on your laptop compared to the HW answers?,machine-learning-zoomcamp,8d1e7e20
How might the optimizer affect the reported accuracy and std deviation when training a model on different devices?,machine-learning-zoomcamp,8d1e7e20
What could be a potential cause for the discrepancy in training metrics when running the wasp/bee model on a mac?,machine-learning-zoomcamp,8d1e7e20
What's a suggested solution if you find a mismatch in your model's accuracy and std deviation versus expected results?,machine-learning-zoomcamp,8d1e7e20
How can changing the runtime environment influence your model's execution speed and alignment with expected HW outcomes?,machine-learning-zoomcamp,8d1e7e20
How can I speed up data loading in model.fit() using multi-threading?,machine-learning-zoomcamp,2023a9dc
What parameter should I use to enhance data generation performance in model.fit()?,machine-learning-zoomcamp,2023a9dc
What is the default value of the workers parameter in model.fit() when using multi-threading?,machine-learning-zoomcamp,2023a9dc
Is there a recommended range for setting the workers value in model.fit()?,machine-learning-zoomcamp,2023a9dc
Where can I find more information on using the workers parameter in model.fit()?,machine-learning-zoomcamp,2023a9dc
How can I ensure reproducibility in TensorFlow when training models?,machine-learning-zoomcamp,468f69ff
What are the steps to achieve consistent training results using TensorFlow?,machine-learning-zoomcamp,468f69ff
What code can I use in TensorFlow to make sure my training runs are the same each time?,machine-learning-zoomcamp,468f69ff
Which TensorFlow function helps with deterministic operations for repeated script execution?,machine-learning-zoomcamp,468f69ff
Where can I find guidance on maintaining reproducibility in TensorFlow as per Sylvia Schmitt's instructions?,machine-learning-zoomcamp,468f69ff
Is PyTorch a suitable alternative framework for completing the neural networks and deep learning lesson?,machine-learning-zoomcamp,c4ff26e5
Can I submit my lessons and homework using PyTorch instead of Keras?,machine-learning-zoomcamp,c4ff26e5
Where can I find a tutorial on creating a CNN from scratch in PyTorch?,machine-learning-zoomcamp,c4ff26e5
Are there differences in syntax between Keras and PyTorch when completing deep learning tasks?,machine-learning-zoomcamp,c4ff26e5
Is it encouraged to contribute PyTorch equivalents of lesson homework through pull requests?,machine-learning-zoomcamp,c4ff26e5
Why does training a Keras model fail with 'Failed to find data adapter' error?,machine-learning-zoomcamp,62722d72
What might cause an error related to data adapter when using a Keras model?,machine-learning-zoomcamp,62722d72
How can the 'Failed to find data adapter' error be resolved when training a Keras model?,machine-learning-zoomcamp,62722d72
What should be corrected if I mistakenly pass the image generator instead of the dataset in Keras model training?,machine-learning-zoomcamp,62722d72
Who contributed the solution for fixing the 'Failed to find data adapter' error in Keras?,machine-learning-zoomcamp,62722d72
How can I repeatedly run 'nvidia-smi' without the 'watch' command?,machine-learning-zoomcamp,d1419be1
What is the built-in function of 'nvidia-smi' for continuous updates?,machine-learning-zoomcamp,d1419be1
How do I execute 'nvidia-smi' every 2 seconds?,machine-learning-zoomcamp,d1419be1
Which command do I use to run 'nvidia-smi' at intervals without extra tools?,machine-learning-zoomcamp,d1419be1
What key combination stops the continuous 'nvidia-smi' command?,machine-learning-zoomcamp,d1419be1
What Python package helps view GPU processes like htop for CPU?,machine-learning-zoomcamp,a5f6f439
Where can I find the interactive GPU process viewer online?,machine-learning-zoomcamp,a5f6f439
Who contributed the information about the interactive GPU process viewer?,machine-learning-zoomcamp,a5f6f439
Which website offers an image source for the GPU process viewer tool?,machine-learning-zoomcamp,a5f6f439
What tool should I use to check GPU utilization for deep learning tasks?,machine-learning-zoomcamp,a5f6f439
"How is the number of parameters for a Conv2D layer calculated when using a 3x3 kernel, 3 input channels, and 32 filters?",machine-learning-zoomcamp,879c1ec0
Why are there 896 parameters in the Conv2D layer with a 3x3 kernel and 32 filters on an RGB image?,machine-learning-zoomcamp,879c1ec0
Can you explain the origin of the 6272 features obtained from the Flatten layer after several convolutions and poolings?,machine-learning-zoomcamp,879c1ec0
"What does the '6272' output shape represent after the Flatten layer when the last MaxPooling2D layer output shape is (None, 7, 7, 128)?",machine-learning-zoomcamp,879c1ec0
How do you determine the number of output features from the Flatten layer given a 7x7 image shape and 128 filters?,machine-learning-zoomcamp,879c1ec0
What approach is recommended for building models from scratch during homework assignments in the course on neural networks and deep learning?,machine-learning-zoomcamp,3ac604c3
Why is it suggested to restart the kernel before correcting errors in neural net architecture?,machine-learning-zoomcamp,3ac604c3
In what situation might it be beneficial to use the Functional Model API as opposed to the Sequential Model API?,machine-learning-zoomcamp,3ac604c3
How are models described in the course's neural networks section generally structured in terms of layers and inputs/outputs?,machine-learning-zoomcamp,3ac604c3
Where can I find a practical example of the Sequential model in action related to the course content?,machine-learning-zoomcamp,3ac604c3
How can I address out of memory errors when running TensorFlow with an Nvidia GPU?,machine-learning-zoomcamp,0315aa96
What should I try if I encounter OOM errors while using TensorFlow on a GPU?,machine-learning-zoomcamp,0315aa96
Can you provide a code snippet for resolving memory issues on Nvidia GPUs in TensorFlow?,machine-learning-zoomcamp,0315aa96
What is a possible solution for fixing OOM errors in TensorFlow when using a GPU?,machine-learning-zoomcamp,0315aa96
Where can I find more information on setting memory growth in TensorFlow for Nvidia GPUs?,machine-learning-zoomcamp,0315aa96
What can I do if my model training is very slow on a T4 GPU in Google Colab?,machine-learning-zoomcamp,daf84bc3
How did Ibai Irastorza address the slow training issue on the T4 GPU in Google Colab?,machine-learning-zoomcamp,daf84bc3
What is the default number of workers set in the fit function for model training?,machine-learning-zoomcamp,daf84bc3
Where can I find more information about changing the number of workers for GPU training in Colab?,machine-learning-zoomcamp,daf84bc3
What variable did Ibai Irastorza modify to improve training speed on the free T4 GPU?,machine-learning-zoomcamp,daf84bc3
Why is ImageDataGenerator deprecated for loading images in a serverless deep learning setup?,machine-learning-zoomcamp,1e956ca7
What is the recommended method for loading images in Keras for new code?,machine-learning-zoomcamp,1e956ca7
Where can I find tutorials on loading and augmenting images in Keras?,machine-learning-zoomcamp,1e956ca7
What is the recommended way to transform the output tf.data.Dataset?,machine-learning-zoomcamp,1e956ca7
Who provided the information about the deprecation of ImageDataGenerator?,machine-learning-zoomcamp,1e956ca7
How can I initiate the tasks for Week 9?,machine-learning-zoomcamp,3ee083ab
What steps should I follow to begin Week 9?,machine-learning-zoomcamp,3ee083ab
Where do I find the initial instructions for Week 9?,machine-learning-zoomcamp,3ee083ab
What is the first action to take for Week 9?,machine-learning-zoomcamp,3ee083ab
How do I start working on Week 9 assignments?,machine-learning-zoomcamp,3ee083ab
Where can I find the model for week 9 after it was moved?,machine-learning-zoomcamp,f826cba4
How do I access the models needed for week 9 of the course?,machine-learning-zoomcamp,f826cba4
What is the current location of the week 9 model?,machine-learning-zoomcamp,f826cba4
Where is the updated link for week 9 models?,machine-learning-zoomcamp,f826cba4
Where should I go to download the models for week 9?,machine-learning-zoomcamp,f826cba4
What should I do if the echo ${REMOTE_URI} command returns nothing in the terminal?,machine-learning-zoomcamp,60fa95ed
How do I set a local variable for REMOTE_URI in the terminal?,machine-learning-zoomcamp,60fa95ed
What happens to the REMOTE_URI variable once the session is terminated?,machine-learning-zoomcamp,60fa95ed
How can I solve the issue of the missing REMOTE_URI output in Ubuntu terminal?,machine-learning-zoomcamp,60fa95ed
Do I need to use curly brackets with REMOTE_URI when using the echo command?,machine-learning-zoomcamp,60fa95ed
What is an alternative command to resolve the invalid choice error when using aws ecr get-login?,machine-learning-zoomcamp,53f3ee10
How can I simplify the AWS ECR login process after encountering syntax issues?,machine-learning-zoomcamp,53f3ee10
Can you provide an example command to successfully get a login password from AWS ECR?,machine-learning-zoomcamp,53f3ee10
What should I use in place of aws ecr get-login to avoid syntax errors?,machine-learning-zoomcamp,53f3ee10
How do I adjust the login command with my specific account number and region on AWS?,machine-learning-zoomcamp,53f3ee10
How can we pass many parameters in a CNN model at once?,machine-learning-zoomcamp,93aa4278
What function allows us to handle multiple parameters in a model?,machine-learning-zoomcamp,93aa4278
Is there a method in keras to pass several parameters simultaneously?,machine-learning-zoomcamp,93aa4278
Which keras function can be used for passing many CNN parameters?,machine-learning-zoomcamp,93aa4278
How do we handle numerous parameters in a model using keras?,machine-learning-zoomcamp,93aa4278
What should I do when encountering the ERROR [internal] load metadata for public.ecr.aws/lambda/python:3.8?,machine-learning-zoomcamp,0edeb016
How can I fix an error related to the Amazon python base image when building a docker image?,machine-learning-zoomcamp,0edeb016
What steps are necessary if updating Docker does not resolve the python:3.8 metadata load error?,machine-learning-zoomcamp,0edeb016
Why might restarting Docker Desktop and terminal help when facing a specific metadata loading error?,machine-learning-zoomcamp,0edeb016
What initial command should be tried if other solutions do not fix the docker build error related to python:3.8?,machine-learning-zoomcamp,0edeb016
Why does the 'ls' command not work in a Windows environment when running a Jupyter notebook?,machine-learning-zoomcamp,ba186de6
What alternative command can I use instead of 'ls -lh' in a Windows Jupyter notebook to view directory contents?,machine-learning-zoomcamp,ba186de6
What error message might appear if I try to use an unsupported command like 'ls' in Windows?,machine-learning-zoomcamp,ba186de6
How can I achieve similar directory listing functionality in Windows that 'ls -lh' provides in Linux?,machine-learning-zoomcamp,ba186de6
What should I do if I encounter the error stating that 'ls' is not recognized in Windows Jupyter notebook?,machine-learning-zoomcamp,ba186de6
Why do I encounter an ImportError indicating that the type 'InterpreterWrapper' is already registered when I run the tflite_runtime.interpreter import?,machine-learning-zoomcamp,da2f1cf4
What causes the 'ImportError: generic_type: type InterpreterWrapper is already registered' when using tflite_runtime.interpreter?,machine-learning-zoomcamp,da2f1cf4
How can I resolve the 'InterpreterWrapper' registration error when importing both tensorflow and tflite_runtime.interpreter in the same notebook?,machine-learning-zoomcamp,da2f1cf4
What steps should I take to fix the ImportError regarding 'InterpreterWrapper' being already registered when working with tflite_runtime.interpreter?,machine-learning-zoomcamp,da2f1cf4
Is there a workaround for the error related to 'InterpreterWrapper' registration when both TensorFlow and tflite_runtime.interpreter are imported?,machine-learning-zoomcamp,da2f1cf4
What could cause an error when using the command $ docker build -t dino_dragon?,machine-learning-zoomcamp,7fd648ca
Why am I getting a 'system cannot find the file specified' error on Windows when using Docker?,machine-learning-zoomcamp,7fd648ca
What might indicate that the Docker daemon is not running on Windows?,machine-learning-zoomcamp,7fd648ca
How can I resolve an error message that suggests the Docker daemon is not running?,machine-learning-zoomcamp,7fd648ca
What is a possible solution if Docker is being stopped by a third-party program?,machine-learning-zoomcamp,7fd648ca
What is one reason for the pip version warning occurring when running docker build -t dino-dragon-model?,machine-learning-zoomcamp,42c09143
How does following Alex's video potentially lead to an error when building the model?,machine-learning-zoomcamp,42c09143
What is a common mistake when trying to use the link provided in the course material?,machine-learning-zoomcamp,42c09143
What should we download to fix the error related to the pip version warning?,machine-learning-zoomcamp,42c09143
What is one of the solutions provided for resolving the error mentioned in the section?,machine-learning-zoomcamp,42c09143
What should we enter for the Default output format when configuring AWS CLI after installation?,machine-learning-zoomcamp,d6d534fc
Is it acceptable to leave the Default output format as None during AWS CLI configuration?,machine-learning-zoomcamp,d6d534fc
Can I use the default settings for AWS CLI configuration except for access keys?,machine-learning-zoomcamp,d6d534fc
"While configuring awscli, is it necessary to change the Default Region Name and Default output format?",machine-learning-zoomcamp,d6d534fc
Should the Access Key ID and Secret Access Key be the only non-default entries during awscli setup?,machine-learning-zoomcamp,d6d534fc
What issue might arise during local testing of a lambda function compared to a running docker instance?,machine-learning-zoomcamp,b2c0c554
Why do numpy float32 values create a problem when used in a model's estimation results?,machine-learning-zoomcamp,b2c0c554
How can model prediction values be made JSON serializable in Python?,machine-learning-zoomcamp,b2c0c554
What change should be made to the dino vs dragon model to prevent JSON serialization errors?,machine-learning-zoomcamp,b2c0c554
Who provided the solution for converting numpy float32 values in the FAQ record?,machine-learning-zoomcamp,b2c0c554
"What type is the error when running 'interpreter.set_tensor(input_index, x)' in section 9?",machine-learning-zoomcamp,819afebc
What is the reason for the error with the 'interpreter.set_tensor' command mentioned in section 9?,machine-learning-zoomcamp,819afebc
How can the error with tensor types be resolved in the serverless deep learning section?,machine-learning-zoomcamp,819afebc
Which TensorFlow version might be related to the still unresolved error in video 9.3?,machine-learning-zoomcamp,819afebc
Who contributed the solution for the tensor value type error in section 9?,machine-learning-zoomcamp,819afebc
What are the command lines required to find file size using PowerShell?,machine-learning-zoomcamp,74551c54
How do I declare a file variable in PowerShell to obtain its size?,machine-learning-zoomcamp,74551c54
Can you show me how to convert the file size into megabytes using PowerShell?,machine-learning-zoomcamp,74551c54
What PowerShell command would I use to assign the file size to a variable?,machine-learning-zoomcamp,74551c54
Where can I find a source for checking file size in PowerShell?,machine-learning-zoomcamp,74551c54
What are Lambda container images and how do they function?,machine-learning-zoomcamp,4d98cd09
Where can I find detailed documentation on Lambda functions initialization?,machine-learning-zoomcamp,4d98cd09
Who contributed information about understanding Lambda container images?,machine-learning-zoomcamp,4d98cd09
Where can I read about creating Lambda container images?,machine-learning-zoomcamp,4d98cd09
What resources provide insight into AWS Lambda runtimes API?,machine-learning-zoomcamp,4d98cd09
How can I deploy a model on AWS Lambda using the AWS Serverless Framework and expose it as a REST API?,machine-learning-zoomcamp,59a81fd5
What steps are involved in creating and pushing a Docker image to AWS ECR for serverless deployment?,machine-learning-zoomcamp,59a81fd5
Can you explain how the AWS Serverless Framework facilitates exposing a Lambda function as a REST API?,machine-learning-zoomcamp,59a81fd5
Where can I find a detailed guide on using AWS Serverless Framework for deploying on AWS Lambda?,machine-learning-zoomcamp,59a81fd5
Who contributed the information on using AWS Serverless Framework to deploy serverless applications to AWS Lambda?,machine-learning-zoomcamp,59a81fd5
What problem might occur when building a Docker image on an M1 Mac in Section 9.5?,machine-learning-zoomcamp,35dbd6e2
What error message might you encounter when installing the tflite runtime using pip?,machine-learning-zoomcamp,35dbd6e2
What is a suggested alternative link if the default tflite runtime link fails during Docker image building?,machine-learning-zoomcamp,35dbd6e2
"Why does the M1 Mac architecture cause issues, and what operating systems can be used as alternatives?",machine-learning-zoomcamp,35dbd6e2
What commands are recommended to successfully build and run a Docker image on M1 Mac?,machine-learning-zoomcamp,35dbd6e2
What could cause an error message saying 'Missing Authentication Token' when invoking the API Gateway locally?,machine-learning-zoomcamp,e5fe9efe
How can I test the API gateway in section 9.7 without encountering authentication issues?,machine-learning-zoomcamp,e5fe9efe
What is needed to successfully invoke the API Gateway with API Gateway: Exposing the Lambda Function?,machine-learning-zoomcamp,e5fe9efe
Could you provide an example of a deployed API URL to use when testing an API Gateway invocation?,machine-learning-zoomcamp,e5fe9efe
Who contributed the solution to the problem of missing authentication token in section 9.7?,machine-learning-zoomcamp,e5fe9efe
What should I do if I encounter the error 'Could not find a version that satisfies the requirement tflite_runtime'?,machine-learning-zoomcamp,5c043c62
Where can I find information on available os-python combinations for tflite_runtime?,machine-learning-zoomcamp,5c043c62
How can I install tflite_runtime if my os-python combination is not available?,machine-learning-zoomcamp,5c043c62
What alternative solutions are there if I cannot install tflite_runtime directly on my machine?,machine-learning-zoomcamp,5c043c62
Where can I find the example code that demonstrates how to install tflite_runtime?,machine-learning-zoomcamp,5c043c62
What should I do if I encounter a docker run error related to a read-only file system?,machine-learning-zoomcamp,af0739da
How can I resolve a Docker error involving mkdir permissions?,machine-learning-zoomcamp,af0739da
What steps can I take to fix an error response from the Docker daemon?,machine-learning-zoomcamp,af0739da
Why might I see a read-only file system error when running Docker?,machine-learning-zoomcamp,af0739da
How do I handle Docker errors that suggest restarting services?,machine-learning-zoomcamp,af0739da
How can a Docker image be saved to a local machine in section 9?,machine-learning-zoomcamp,451bc25d
In what format should a Docker image be exported for local storage?,machine-learning-zoomcamp,451bc25d
Which command allows saving a Docker image as a tar file on a local system?,machine-learning-zoomcamp,451bc25d
How can you view the individual layers of a Docker image's filesystem content?,machine-learning-zoomcamp,451bc25d
What file in the exported tar allows viewing the Docker image layers?,machine-learning-zoomcamp,451bc25d
How can I resolve an issue where Jupyter notebook doesn't recognize a package I installed?,machine-learning-zoomcamp,ea2e7458
What should I do if a Python import isn't working in Jupyter after installation?,machine-learning-zoomcamp,ea2e7458
How to fix package import errors in Jupyter notebook on VSCode?,machine-learning-zoomcamp,ea2e7458
Is there a step needed after pip install for imports in Jupyter to work correctly?,machine-learning-zoomcamp,ea2e7458
What action can help if using 'from PIL import Image' fails in a Jupyter notebook?,machine-learning-zoomcamp,ea2e7458
What should I do if I run out of storage space on my AWS instance?,machine-learning-zoomcamp,6ce8e875
Does deleting docker images immediately free up space on my instance?,machine-learning-zoomcamp,6ce8e875
How can I completely remove unused docker images to clear storage?,machine-learning-zoomcamp,6ce8e875
Is there an additional step needed after removing docker images to free up space?,machine-learning-zoomcamp,6ce8e875
What command should I use to free up space after deleting docker images?,machine-learning-zoomcamp,6ce8e875
Is it possible to use Tensorflow 2.15 for AWS deployment with python 3.11?,machine-learning-zoomcamp,b50e9e2b
What should I do if using Tensorflow 2.15 does not work for AWS deployment?,machine-learning-zoomcamp,b50e9e2b
Which Tensorflow version should I use on Python 3.8 for AWS deployment?,machine-learning-zoomcamp,b50e9e2b
Who provided the information on using Tensorflow 2.14 with python 3.11?,machine-learning-zoomcamp,b50e9e2b
What issues might arise if using an unsupported Python version with Tensorflow 2.4.4?,machine-learning-zoomcamp,b50e9e2b
What should I do if I encounter an error with aws ecr get-login --no-include-email while working on serverless deep learning?,machine-learning-zoomcamp,29311ef5
How can I resolve the issue where aws ecr get-login --no-include-email returns an invalid choice error?,machine-learning-zoomcamp,29311ef5
Is there a solution in the FAQ for the aws ecr get-login --no-include-email command error I encountered?,machine-learning-zoomcamp,29311ef5
Where can I find guidance on fixing the aws ecr get-login --no-include-email invalid choice error?,machine-learning-zoomcamp,29311ef5
Can you direct me to resources for solving the aws ecr get-login --no-include-email argument operation error?,machine-learning-zoomcamp,29311ef5
What steps should I follow to log in to the AWS Console and navigate to IAM for Week 9's Serverless module?,machine-learning-zoomcamp,1e0dc11c
How can I create a new IAM policy that includes specific ECR actions?,machine-learning-zoomcamp,1e0dc11c
What JSON policy is required to allow ECR actions for the Serverless Deep Learning section?,machine-learning-zoomcamp,1e0dc11c
"What error message might I see if there's an issue with docker credentials, and how can it be resolved?",machine-learning-zoomcamp,1e0dc11c
Who contributed the solution for the error related to docker credentials in the WSL2 system environment?,machine-learning-zoomcamp,1e0dc11c
How do I resolve a Docker temporary failure in name resolution error?,machine-learning-zoomcamp,1078aeb7
What should I add to vim /etc/docker/daemon.json for DNS issues?,machine-learning-zoomcamp,1078aeb7
How can I configure Docker's DNS settings?,machine-learning-zoomcamp,1078aeb7
What is the procedure for fixing name resolution errors in Docker?,machine-learning-zoomcamp,1078aeb7
How do I restart Docker after changing its daemon.json file?,machine-learning-zoomcamp,1078aeb7
What should I do if my Keras model .h5 file isn't loading due to an invalid weight_decay argument?,machine-learning-zoomcamp,7daaca73
How can I resolve an error related to an optimizer_experimental.Optimizer in Keras?,machine-learning-zoomcamp,7daaca73
What is the solution for loading a Keras model when kwargs need to be empty?,machine-learning-zoomcamp,7daaca73
How can I load a Keras .h5 model file without encountering an error involving weight_decay?,machine-learning-zoomcamp,7daaca73
What parameter should be added to load a Keras model if weight_decay raises an issue?,machine-learning-zoomcamp,7daaca73
What is the tool used for testing an AWS Lambda with Docker setup locally?,machine-learning-zoomcamp,0cfbe2e2
What is the base image required for building the Docker image to test AWS Lambda locally?,machine-learning-zoomcamp,0cfbe2e2
