question,course,document
How can I create a GitHub repository for my course notes?,machine-learning-zoomcamp,ae52a907
What is the process for linking my notes to the course repo?,machine-learning-zoomcamp,ae52a907
How do I fork the original course repository?,machine-learning-zoomcamp,ae52a907
What should I do after I have linked my notes in my repo?,machine-learning-zoomcamp,ae52a907
How can I ensure my forked repo is up to date with the original repo?,machine-learning-zoomcamp,ae52a907
Where can I find the leaderboard links for the years 2023 and 2022?,machine-learning-zoomcamp,dab5a24a
How do I compute the hash for my email using Python code?,machine-learning-zoomcamp,dab5a24a
Can you explain how to use the website to hash my email online?,machine-learning-zoomcamp,dab5a24a
What is the purpose of using quotes when passing my email to the compute_hash function?,machine-learning-zoomcamp,dab5a24a
Who are the contributors mentioned in the solution for computing the hash and leaderboard?,machine-learning-zoomcamp,dab5a24a
How can I resolve the error 'wget is not recognized as an internal or external command'?,machine-learning-zoomcamp,49f9bda9
What command should I use to install wget on a Mac?,machine-learning-zoomcamp,49f9bda9
How can I download a file from a URL using Python's standard library?,machine-learning-zoomcamp,49f9bda9
What is an alternative method to download a CSV file from a URL into a pandas DataFrame?,machine-learning-zoomcamp,49f9bda9
How do I bypass HTTPS checks in Python when downloading files from the internet?,machine-learning-zoomcamp,49f9bda9
How can you download a CSV file inside a notebook?,machine-learning-zoomcamp,d44de7d1
What shell command allows creating a directory inside a notebook?,machine-learning-zoomcamp,d44de7d1
What is the purpose of an exclamation mark when working with shell commands in notebooks?,machine-learning-zoomcamp,d44de7d1
How can you move a CSV file to a data directory alongside your notebook?,machine-learning-zoomcamp,d44de7d1
What are some shell commands that can generally be executed within a notebook?,machine-learning-zoomcamp,d44de7d1
How can I set up a WSL development environment on my Windows 11 device?,machine-learning-zoomcamp,314ebe32
What extension should I download to connect VS Code to WSL?,machine-learning-zoomcamp,314ebe32
Is there a resource to help me access Linux using WSL on Windows 11?,machine-learning-zoomcamp,314ebe32
How does the VS Code extension help with connecting to WSL Ubuntu?,machine-learning-zoomcamp,314ebe32
Can I use WSL on Windows 11 to simulate a Linux virtual machine in VS Code?,machine-learning-zoomcamp,314ebe32
What should I do if I encounter an error message stating 'src refspec master does not match any' when trying to push my code to GitHub?,machine-learning-zoomcamp,98cff602
How can I upload my code to GitHub from Google Colab?,machine-learning-zoomcamp,98cff602
Is there a tutorial available for beginners on how to use GitHub?,machine-learning-zoomcamp,98cff602
What alternative method can I use to upload files to GitHub without using the command line?,machine-learning-zoomcamp,98cff602
Which command should I use to push my initial commit to the main branch on GitHub?,machine-learning-zoomcamp,98cff602
What causes a singular matrix error in machine learning assignments?,machine-learning-zoomcamp,54ec0de4
Why is the order of matrix multiplication important to avoid singular matrix errors?,machine-learning-zoomcamp,54ec0de4
How does the .dot method affect matrix inversion in homework problems?,machine-learning-zoomcamp,54ec0de4
Why can't every matrix be inverted in machine learning exercises?,machine-learning-zoomcamp,54ec0de4
What should I be cautious about when using the .dot method in matrix operations?,machine-learning-zoomcamp,54ec0de4
What should I do if the 'conda create' command is not recognized in my terminal?,machine-learning-zoomcamp,f81f4ecb
Which Python versions are compatible with the command for creating a new environment?,machine-learning-zoomcamp,f81f4ecb
What terminal should Windows users utilize after installing Anaconda for executing the 'conda' commands?,machine-learning-zoomcamp,f81f4ecb
What steps should I take if I do not have Anaconda or Miniconda installed?,machine-learning-zoomcamp,f81f4ecb
Does the issue with 'conda' not being an internal command pertain to a specific operating system?,machine-learning-zoomcamp,f81f4ecb
What should I do when my Pandas read_csv command for Windows uses backslashes but doesn't work?,machine-learning-zoomcamp,be760b92
Why does using a backslash in Windows file paths conflict with Python when reading a file with Pandas?,machine-learning-zoomcamp,be760b92
"How can I fix the issue of reading files in Windows using Pandas, given the escape sequence problem?",machine-learning-zoomcamp,be760b92
"What is an escape sequence, and how does it affect file path reading in Windows using Pandas?",machine-learning-zoomcamp,be760b92
How should I modify my file path in Python to correctly read a CSV file on Windows using Pandas?,machine-learning-zoomcamp,be760b92
How can I resolve a '403 Forbidden' error when pushing to a GitHub repository?,machine-learning-zoomcamp,a2cfa1c9
What command should I use to check the current URL configuration for a remote GitHub repository?,machine-learning-zoomcamp,a2cfa1c9
What should the URL format be when setting a new GitHub remote origin?,machine-learning-zoomcamp,a2cfa1c9
Who added the solution for changing the remote URL in the FAQ?,machine-learning-zoomcamp,a2cfa1c9
What is the first step to ensure the URL change is reflected for a GitHub repository?,machine-learning-zoomcamp,a2cfa1c9
How can I resolve the fatal authentication error when pushing code to GitHub from Git Bash?,machine-learning-zoomcamp,7b907071
"What happened on August 13, 2021, that affects GitHub password authentication?",machine-learning-zoomcamp,7b907071
What is the recommended method for pushing code to GitHub after password authentication was removed?,machine-learning-zoomcamp,7b907071
Where can I create a personal access token for GitHub authentication?,machine-learning-zoomcamp,7b907071
Where can I find instructions for generating and adding a new SSH key on GitHub?,machine-learning-zoomcamp,7b907071
What should I do if I see 'wget: unable to resolve host address' in Kaggle?,machine-learning-zoomcamp,fc2e0a61
How can I fix the 'Temporary failure in name resolution' error in Kaggle?,machine-learning-zoomcamp,fc2e0a61
Where in Kaggle can I enable Internet access for a session?,machine-learning-zoomcamp,fc2e0a61
Why is Kaggle asking for my phone number to verify internet access?,machine-learning-zoomcamp,fc2e0a61
What might cause wget to fail when retrieving data from GitHub in Kaggle?,machine-learning-zoomcamp,fc2e0a61
How can I create a virtual environment for Python using VS Code?,machine-learning-zoomcamp,d43e5742
Does VS Code support running Jupyter Notebooks without using a web browser?,machine-learning-zoomcamp,d43e5742
What do I need to enable to execute remote Jupyter Notebooks from my local machine in VS Code?,machine-learning-zoomcamp,d43e5742
Can I perform Git operations like staging and committing directly from VS Code?,machine-learning-zoomcamp,d43e5742
Where can I find resources to work with GitHub using VS Code's UI?,machine-learning-zoomcamp,d43e5742
Do we need to execute 'conda create -n....' each time we use VS Code for the project?,machine-learning-zoomcamp,32bc0538
Is it necessary to run 'conda activate ml-zoomcamp' every time I work on the project?,machine-learning-zoomcamp,32bc0538
How can I save my current Conda environment to a file?,machine-learning-zoomcamp,32bc0538
What is the purpose of the command 'conda env export > environment.yml'?,machine-learning-zoomcamp,32bc0538
How can I recreate an environment using a YAML file?,machine-learning-zoomcamp,32bc0538
What could be the reason for not getting an identity matrix when multiplying an inverse by its original matrix?,machine-learning-zoomcamp,b6730228
Why does floating-point precision sometimes fail on computers?,machine-learning-zoomcamp,b6730228
How can I verify the accuracy of the inverse matrix in the context of machine learning?,machine-learning-zoomcamp,b6730228
What issue might arise when performing matrix inversion in Week 1 homework?,machine-learning-zoomcamp,b6730228
Where can I find more information about floating-point math issues on computers?,machine-learning-zoomcamp,b6730228
What command can you use to view dataset memory usage and datatype information?,machine-learning-zoomcamp,3ce9bbb8
How can you check the number of entries and non-null counts in a dataset?,machine-learning-zoomcamp,3ce9bbb8
What function provides column details including datatype in a DataFrame?,machine-learning-zoomcamp,3ce9bbb8
Which tool can display index datatype and memory usage of a dataset?,machine-learning-zoomcamp,3ce9bbb8
How do you obtain column information including not-null count using pandas?,machine-learning-zoomcamp,3ce9bbb8
What should I do if I encounter a NameError stating 'np' is not defined?,machine-learning-zoomcamp,4e584d06
Why do I get a NameError indicating 'np' in my machine learning project?,machine-learning-zoomcamp,4e584d06
How can I fix a NameError related to 'pd' when I'm working with data?,machine-learning-zoomcamp,4e584d06
What is a common fix for NameError: name 'pd' is not defined in Python scripts?,machine-learning-zoomcamp,4e584d06
When is it necessary to include import pandas as pd and import numpy as np?,machine-learning-zoomcamp,4e584d06
How can I list columns of a numeric data type using pandas?,machine-learning-zoomcamp,ff4da2b6
What method allows me to retrieve columns with object data types?,machine-learning-zoomcamp,ff4da2b6
"If a DataFrame has numerous columns, how can I efficiently select only numeric ones?",machine-learning-zoomcamp,ff4da2b6
What approach should I use to get columns with string data efficiently in pandas?,machine-learning-zoomcamp,ff4da2b6
What pandas function is helpful for selecting columns by data type?,machine-learning-zoomcamp,ff4da2b6
What is a method to determine the size of a dataset in Pandas?,machine-learning-zoomcamp,58c1c168
How can you find out the number of rows in a Pandas DataFrame?,machine-learning-zoomcamp,58c1c168
What attribute helps you identify the column count in a dataset with Pandas?,machine-learning-zoomcamp,58c1c168
Which attribute in Pandas is used to check dataset dimensions?,machine-learning-zoomcamp,58c1c168
Who contributed information on using .shape in Pandas?,machine-learning-zoomcamp,58c1c168
How can I prevent Value errors with array shapes in matrix multiplication for homework?,machine-learning-zoomcamp,96076a1a
What should I use for matrix multiplication to avoid Value errors in assignments?,machine-learning-zoomcamp,96076a1a
Why is the order of multiplying matrices important in avoiding errors?,machine-learning-zoomcamp,96076a1a
What should match to ensure correct matrix multiplication without errors?,machine-learning-zoomcamp,96076a1a
Who added the tip on avoiding dimension mismatch in matrix operations?,machine-learning-zoomcamp,96076a1a
Why is it necessary to impute NaN values instead of removing the row entirely?,machine-learning-zoomcamp,3218389a
What is the standard method for handling NaN values in data columns during machine learning?,machine-learning-zoomcamp,3218389a
How can we calculate the average of a column to replace its NaN values effectively?,machine-learning-zoomcamp,3218389a
"In data preprocessing, what technique is used to handle null values without losing important data?",machine-learning-zoomcamp,3218389a
Can you explain the process of replacing missing values with the average in a data set?,machine-learning-zoomcamp,3218389a
What is the mathematical formula for linear regression covered in Question 7 of the Introduction to Machine Learning section?,machine-learning-zoomcamp,183a1c90
Which additional readings and videos are recommended for understanding linear regression in Section 1?,machine-learning-zoomcamp,183a1c90
Who contributed comments to the answer for Question 7 on linear regression in the Introduction to Machine Learning section?,machine-learning-zoomcamp,183a1c90
What does the mathematical solution involve for the linear regression problem mentioned in Question 7?,machine-learning-zoomcamp,183a1c90
Who is acknowledged as having added the answer to Question 7 in the Introduction to Machine Learning section?,machine-learning-zoomcamp,183a1c90
What might cause the final multiplication to not have 5 columns?,machine-learning-zoomcamp,f0bc1c19
Why does the final multiplication step sometimes miss columns?,machine-learning-zoomcamp,f0bc1c19
How can interchanging steps affect the outcome of the multiplication?,machine-learning-zoomcamp,f0bc1c19
What could be a reason for an incorrect column count in the multiplication final step?,machine-learning-zoomcamp,f0bc1c19
Who provided the solution for issues with the final multiplication column count?,machine-learning-zoomcamp,f0bc1c19
What operators should I use for matrix multiplication according to numpy documentation?,machine-learning-zoomcamp,735e6c78
Which operator is used for element-wise multiplication?,machine-learning-zoomcamp,735e6c78
Is the * operator suitable for scalar multiplication in numpy?,machine-learning-zoomcamp,735e6c78
When should I use numpy.matmul() over numpy.dot() for matrix operations?,machine-learning-zoomcamp,735e6c78
Who added the note about multiplication operators in this section?,machine-learning-zoomcamp,735e6c78
What should I do if I encounter an ImportError related to 'contextfilter' from 'jinja2' when starting a new Jupyter notebook?,machine-learning-zoomcamp,b8ca1cd3
How can I resolve the error 'cannot import name contextfilter' from 'jinja2' in a new environment?,machine-learning-zoomcamp,b8ca1cd3
What steps are recommended if I receive an ImportError while launching a notebook in a new environment?,machine-learning-zoomcamp,b8ca1cd3
How do I fix the issue where Jupyter notebook cannot import 'contextfilter' from 'jinja2'?,machine-learning-zoomcamp,b8ca1cd3
What is the solution for the jinja2 ImportError when opening a new Jupyter notebook?,machine-learning-zoomcamp,b8ca1cd3
How can a MacOS Ventura M1 user fix wget when it hangs with IPv6 addresses?,machine-learning-zoomcamp,efdb235f
What steps should a MacOS Ventura M1 user take if wget hangs during download?,machine-learning-zoomcamp,efdb235f
What is the solution for wget hanging on MacOS Ventura M1 due to IPv6 issues?,machine-learning-zoomcamp,efdb235f
How do I resolve wget hanging with IPv6 on MacOS Ventura M1?,machine-learning-zoomcamp,efdb235f
What network settings should be configured to fix wget hanging on MacOS Ventura M1?,machine-learning-zoomcamp,efdb235f
What should macOS users use instead of WGET for downloading files?,machine-learning-zoomcamp,355348f0
Can you explain what curl does for retrieving files from the internet?,machine-learning-zoomcamp,355348f0
How do you use curl to save the result as a specific file?,machine-learning-zoomcamp,355348f0
Where should I specify the web address when using curl for downloading?,machine-learning-zoomcamp,355348f0
Where can I find more information about how to use curl?,machine-learning-zoomcamp,355348f0
How can I limit decimal places in my output for machine learning regression tasks?,machine-learning-zoomcamp,67afabf5
What function can I use to round a number to four decimal places in Python?,machine-learning-zoomcamp,67afabf5
How do I format a floating-point number to three decimal places using an f-string?,machine-learning-zoomcamp,67afabf5
"If I need to round all values in a pandas Series, what method should I refer to?",machine-learning-zoomcamp,67afabf5
Where can I find documentation on rounding values in a pandas Series?,machine-learning-zoomcamp,67afabf5
"What are the essential links for the second week starting on September 18, 2023?",machine-learning-zoomcamp,50d737e7
Where can I find and submit the homework for Week 2?,machine-learning-zoomcamp,50d737e7
How can I access the calendar for our weekly meetings?,machine-learning-zoomcamp,50d737e7
Where do I ask questions for live sessions during this week?,machine-learning-zoomcamp,50d737e7
Can you direct me to the GitHub repository for the course theory?,machine-learning-zoomcamp,50d737e7
How can we visualize the distribution of median house values?,machine-learning-zoomcamp,bbc0fca3
What tools are recommended for checking if data has a long tail?,machine-learning-zoomcamp,bbc0fca3
How do we assess the skewness of the median house values?,machine-learning-zoomcamp,bbc0fca3
Can you share a method for performing exploratory data analysis using a provided dataset?,machine-learning-zoomcamp,bbc0fca3
What python libraries are needed to plot a histogram in this example?,machine-learning-zoomcamp,bbc0fca3
Why might I encounter a Singular Matrix LinAlgError while following the course videos?,machine-learning-zoomcamp,6f3bdd20
What might cause a Singular Matrix error when coding along with the videos?,machine-learning-zoomcamp,6f3bdd20
How is the Singular Matrix error addressed in this course?,machine-learning-zoomcamp,6f3bdd20
Could performing an inverse operation on X multiple times lead to an error?,machine-learning-zoomcamp,6f3bdd20
Who provided the explanation for the Singular Matrix error in the course?,machine-learning-zoomcamp,6f3bdd20
Where can I find a detailed description of the California housing dataset used in this course?,machine-learning-zoomcamp,27c2d90a
Is there a specific link to access information about the California housing dataset?,machine-learning-zoomcamp,27c2d90a
Can you direct me to where I can read more about the dataset we are using from California housing?,machine-learning-zoomcamp,27c2d90a
"I need to find a detailed page about the California housing dataset, could you provide that?",machine-learning-zoomcamp,27c2d90a
Do you have a URL for detailed information on the California housing dataset?,machine-learning-zoomcamp,27c2d90a
Why am I getting NaNs when calculating the mean in my RMSE function?,machine-learning-zoomcamp,88e9600a
What steps did I miss if my RMSE calculations are returning NaNs?,machine-learning-zoomcamp,88e9600a
Can leaving NaNs in my dataset influence RMSE calculations?,machine-learning-zoomcamp,88e9600a
How can I resolve NaNs appearing after applying .mean() in my model evaluation?,machine-learning-zoomcamp,88e9600a
Why did applying fillna(0) on validation and test data fix my RMSE issue?,machine-learning-zoomcamp,88e9600a
Why might we apply a logarithmic transformation to the target variable in regression models?,machine-learning-zoomcamp,d59d8df7
What is the main reason we consider transforming the distribution of the target variable?,machine-learning-zoomcamp,d59d8df7
How can we assess whether the target variable requires transformation?,machine-learning-zoomcamp,d59d8df7
Should every machine learning project involve transforming the target variable?,machine-learning-zoomcamp,d59d8df7
What resource can help understand the assessment of skewness in data?,machine-learning-zoomcamp,d59d8df7
How can the dataset be directly imported into a pandas dataframe from GitHub?,machine-learning-zoomcamp,0b3eaf92
What is the method for loading a dataset from a GitHub link into a dataframe?,machine-learning-zoomcamp,0b3eaf92
Is there a way to read a dataset directly from a GitHub URL into pandas?,machine-learning-zoomcamp,0b3eaf92
How do you read a CSV file from a GitHub repository directly into pandas?,machine-learning-zoomcamp,0b3eaf92
"Can pandas read a CSV directly from a GitHub link, and how is it done?",machine-learning-zoomcamp,0b3eaf92
How can Kaggle notebook users load a dataset for regression analysis?,machine-learning-zoomcamp,8fe56032
What is the wget command needed to download a dataset directly in Kaggle?,machine-learning-zoomcamp,8fe56032
Is there a specific requirement when using wget in Kaggle Notebooks?,machine-learning-zoomcamp,8fe56032
How do I read the loaded dataset into a pandas DataFrame using Kaggle?,machine-learning-zoomcamp,8fe56032
What is essential to remember when downloading datasets in Kaggle notebooks?,machine-learning-zoomcamp,8fe56032
How can I filter a dataset based on specific values in a column like ocean_proximity?,machine-learning-zoomcamp,af833e0a
What is the method to apply an OR condition when filtering a dataset?,machine-learning-zoomcamp,af833e0a
Is there an alternative way to filter a dataset using multiple conditions besides using | or &?,machine-learning-zoomcamp,af833e0a
Can you show an example of filtering a dataset for values <1H OCEAN and INLAND in a specific column?,machine-learning-zoomcamp,af833e0a
Are there any shorthand methods for checking if column values match a list of criteria in data filtering?,machine-learning-zoomcamp,af833e0a
How can I retrieve a dataset from a website using the requests library?,machine-learning-zoomcamp,8d209d6d
Is there a way to download data directly from a URL for a homework assignment?,machine-learning-zoomcamp,8d209d6d
What should I do if my attempt to download a file with requests returns an error?,machine-learning-zoomcamp,8d209d6d
Can you demonstrate using the requests library to save a CSV file from an online source?,machine-learning-zoomcamp,8d209d6d
What steps do I follow to store a response's content using Python's requests library?,machine-learning-zoomcamp,8d209d6d
How can I prevent a null column from appearing after using the .fillna() method?,machine-learning-zoomcamp,0bc4c3da
Why does my dataframe show a null column despite applying .fillna() on it?,machine-learning-zoomcamp,0bc4c3da
What is a shallow copy in the context of creating dataframes for machine learning?,machine-learning-zoomcamp,0bc4c3da
How can I ensure that I create a deep copy of my dataframe to avoid null columns?,machine-learning-zoomcamp,0bc4c3da
What is the correct way to duplicate a dataframe without referencing the original variable using .copy()?,machine-learning-zoomcamp,0bc4c3da
Is it acceptable to use Scikit-Learn’s train_test_split during this week's exercises?,machine-learning-zoomcamp,c0ee2665
Will we eventually rely on Scikit-Learn’s functions instead of implementing our own?,machine-learning-zoomcamp,c0ee2665
Are there any objections if I decide to use Scikit-Learn’s functions before it's introduced in the course?,machine-learning-zoomcamp,c0ee2665
Will we manually implement train_test_split only for this week’s practice?,machine-learning-zoomcamp,c0ee2665
Can I freely choose to apply Scikit-Learn’s train_test_split earlier than planned in the course?,machine-learning-zoomcamp,c0ee2665
Is it possible to apply Scikit-Learn's LinearRegression in our current studies?,machine-learning-zoomcamp,3f60871d
Are we allowed to utilize LinearRegression from Scikit-Learn in the current module?,machine-learning-zoomcamp,3f60871d
Can we incorporate LinearRegression from the Scikit-Learn library in our assignments this week?,machine-learning-zoomcamp,3f60871d
Is LinearRegression from Scikit-Learn applicable for our exercises this session?,machine-learning-zoomcamp,3f60871d
Can using Scikit-Learn's LinearRegression be part of our learning process currently?,machine-learning-zoomcamp,3f60871d
What are the Scikit-Learn functions for linear regression without regularization in week 2?,machine-learning-zoomcamp,f30217a7
Which Scikit-Learn function is used for linear regression with regularization in the course?,machine-learning-zoomcamp,f30217a7
Where can I find explanations for linear model functions in Scikit-Learn?,machine-learning-zoomcamp,f30217a7
Can you tell me the equivalent Scikit-Learn function for linear regression without regularization?,machine-learning-zoomcamp,f30217a7
What is the corresponding function in Scikit-Learn for a regularization-based linear model?,machine-learning-zoomcamp,f30217a7
What role does the parameter 'r' play in the 'train_linear_regression_reg' function compared to 'alpha' in sklearn.Ridge()?,machine-learning-zoomcamp,91fc573d
How does increasing the 'r' in the lesson’s notebook affect the regularization strength?,machine-learning-zoomcamp,91fc573d
Is the 'alpha' parameter in sklearn.Ridge() equivalent to 'r' in terms of their mathematical usage?,machine-learning-zoomcamp,91fc573d
Why is 'r' added to the main diagonal in the 'train_linear_regression_reg' function?,machine-learning-zoomcamp,91fc573d
Can using a higher 'r' or 'alpha' impact the inversion of a matrix in relation to multicollinearity?,machine-learning-zoomcamp,91fc573d
questions,machine-learning-zoomcamp,fe3139f6
Why do all missing values in the homework end up in the training dataframe when using a random seed of 42?,machine-learning-zoomcamp,48aac030
What is the reason for using a specific random seed value like 42 in machine learning exercises?,machine-learning-zoomcamp,48aac030
How does changing the random seed value affect the distribution of missing values across dataframes?,machine-learning-zoomcamp,48aac030
Why does using seed 42 ensure consistent behavior among all learners in the course?,machine-learning-zoomcamp,48aac030
"What happens to the placement of missing values if a different random seed, such as 9, is used?",machine-learning-zoomcamp,48aac030
How can I shuffle my dataset using a pandas built-in function?,machine-learning-zoomcamp,28321bc2
What command allows me to reset the index after shuffling my dataset with pandas?,machine-learning-zoomcamp,28321bc2
How do I ensure that my dataset shuffling is reproducible like the course resources?,machine-learning-zoomcamp,28321bc2
What does setting frac=1 achieve when shuffling a dataset with pandas?,machine-learning-zoomcamp,28321bc2
How can I achieve the same randomization as the course resources when shuffling my dataset?,machine-learning-zoomcamp,28321bc2
