question,course,document
When does the course begin?,data-engineering-zoomcamp,c02e79ef
What time will the course start on January 15th?,data-engineering-zoomcamp,c02e79ef
How can I subscribe to the course's Google Calendar?,data-engineering-zoomcamp,c02e79ef
Where should I register before the course starts?,data-engineering-zoomcamp,c02e79ef
How do I join the course Telegram channel?,data-engineering-zoomcamp,c02e79ef
Where can I find the prerequisites for this class?,data-engineering-zoomcamp,1f6520ca
Is there a link to the course requirements?,data-engineering-zoomcamp,1f6520ca
Where are details about necessary prior knowledge for this course?,data-engineering-zoomcamp,1f6520ca
How can I check if I meet the course prerequisites?,data-engineering-zoomcamp,1f6520ca
Where should I look for the entry requirements of this course?,data-engineering-zoomcamp,1f6520ca
Can I enroll after the course has begun?,data-engineering-zoomcamp,7842b56a
Am I eligible to submit assignments without registering?,data-engineering-zoomcamp,7842b56a
Are there deadlines for final project submissions?,data-engineering-zoomcamp,7842b56a
Is it possible to join the course once it's already started?,data-engineering-zoomcamp,7842b56a
Will I face any issues if I register late but submit all assignments?,data-engineering-zoomcamp,7842b56a
When will I get the confirmation email after registering for the Data Engineering Bootcamp?,data-engineering-zoomcamp,0bbf41ec
What should I do if I don't receive a confirmation email for the Data Engineering Bootcamp?,data-engineering-zoomcamp,0bbf41ec
Is receiving a confirmation email necessary before starting the Data Engineering Bootcamp?,data-engineering-zoomcamp,0bbf41ec
Can I start submitting homework for the Data Engineering Bootcamp without registering?,data-engineering-zoomcamp,0bbf41ec
How important is registration for the Data Engineering Bootcamp if I can start learning without it?,data-engineering-zoomcamp,0bbf41ec
What preparation can I undertake before the course begins?,data-engineering-zoomcamp,63394d91
Which tools should I set up before the course starts?,data-engineering-zoomcamp,63394d91
What account do I need to create prior to the course commencement?,data-engineering-zoomcamp,63394d91
Which programming language should be installed before the course starts?,data-engineering-zoomcamp,63394d91
What should I check to ensure I'm ready for the course material?,data-engineering-zoomcamp,63394d91
How many Zoom Camps are held in a year?,data-engineering-zoomcamp,2ed9b986
When does the Data-Engineering Zoomcamp typically take place?,data-engineering-zoomcamp,2ed9b986
Is there more than one live cohort for the Data-Engineering Zoomcamp each year?,data-engineering-zoomcamp,2ed9b986
Can I take Zoom Camps at my own pace without participating in a live cohort?,data-engineering-zoomcamp,2ed9b986
What are the time frames for the MLOps and Machine Learning Zoom Camps?,data-engineering-zoomcamp,2ed9b986
Will the 2024 cohort use the same tools as the 2023 cohort for the course?,data-engineering-zoomcamp,93e2c8ed
What AI tool is being used for the 2024 course edition instead of the previous one?,data-engineering-zoomcamp,93e2c8ed
Have any course videos been updated for the 2024 cohort?,data-engineering-zoomcamp,93e2c8ed
Which AI tool was replaced by Mage AI for the 2024 course edition?,data-engineering-zoomcamp,93e2c8ed
Were there any changes to the AI tools used for the course from 2023 to 2024?,data-engineering-zoomcamp,93e2c8ed
"After the course ends, can I still access the materials to study at my own pace?",data-engineering-zoomcamp,a482086d
Is it possible to review homeworks and prepare for the next cohort post-course completion?,data-engineering-zoomcamp,a482086d
Will I have the opportunity to work on my final capstone project once the course is over?,data-engineering-zoomcamp,a482086d
Are the course materials available even after the course has concluded?,data-engineering-zoomcamp,a482086d
Can I use the course resources to continue learning after it officially ends?,data-engineering-zoomcamp,a482086d
"If I enroll in self-paced mode, can I still receive support during the course?",data-engineering-zoomcamp,eb56ae98
How can I ask questions if I encounter difficulties while taking the course independently?,data-engineering-zoomcamp,eb56ae98
What should I do before asking a question in the Slack channel for this course?,data-engineering-zoomcamp,eb56ae98
Is there a bot that can assist me in finding answers to my questions during the course?,data-engineering-zoomcamp,eb56ae98
Should I fully trust the responses provided by the ZoomcampQABot when seeking course assistance?,data-engineering-zoomcamp,eb56ae98
Which YouTube playlist contains the main videos for the course?,data-engineering-zoomcamp,4292531b
Where can I find year-specific course videos like office hours?,data-engineering-zoomcamp,4292531b
How can I access the videos directly from the Github repository?,data-engineering-zoomcamp,4292531b
What is the link to access the main playlist on YouTube?,data-engineering-zoomcamp,4292531b
Where is the course's main playlist shared in the Slack channel?,data-engineering-zoomcamp,4292531b
What is the weekly time commitment for this course?,data-engineering-zoomcamp,ea739c65
How many hours should I dedicate to this course each week?,data-engineering-zoomcamp,ea739c65
What is the expected weekly investment of time for this course?,data-engineering-zoomcamp,ea739c65
How much time will I spend on this course every week?,data-engineering-zoomcamp,ea739c65
What is the approximate weekly hour requirement for this course?,data-engineering-zoomcamp,ea739c65
Can I earn a certificate if I complete the course in a self-paced mode?,data-engineering-zoomcamp,cb257ee5
Why are certificates not awarded for self-paced course completion?,data-engineering-zoomcamp,cb257ee5
What is required for obtaining a certificate from this course?,data-engineering-zoomcamp,cb257ee5
Is peer-review necessary for certificate eligibility in this course?,data-engineering-zoomcamp,cb257ee5
When can projects be peer-reviewed to qualify for a certificate?,data-engineering-zoomcamp,cb257ee5
How can students participate in the office hour sessions?,data-engineering-zoomcamp,04aa4897
Where can students find the YouTube Live link for office hours?,data-engineering-zoomcamp,04aa4897
How should students submit their questions during workshops?,data-engineering-zoomcamp,04aa4897
Why shouldn't students post questions directly in the YouTube chat?,data-engineering-zoomcamp,04aa4897
Where is the video URL for office hours announced before the session begins?,data-engineering-zoomcamp,04aa4897
"If I'm unable to join the live 'Office Hours' session, will I be able to watch it later?",data-engineering-zoomcamp,9681be3b
Are recordings available for the workshop sessions if I miss attending them live?,data-engineering-zoomcamp,9681be3b
Can I access a recording of the 'Office Hours' if I want to review it?,data-engineering-zoomcamp,9681be3b
Is there an option to watch recordings of live 'Office Hours' sessions afterwards?,data-engineering-zoomcamp,9681be3b
Will the 'Office Hours' be captured on video for later viewing if I don't attend?,data-engineering-zoomcamp,9681be3b
Where can I find the most current deadlines for homework and projects?,data-engineering-zoomcamp,a1daf537
How do I know if there are extensions for the homework deadlines?,data-engineering-zoomcamp,a1daf537
Who should I follow for news about deadline changes?,data-engineering-zoomcamp,a1daf537
What should I check if I think the homework deadline has been updated?,data-engineering-zoomcamp,a1daf537
Is there a link to view the latest homework and project deadlines?,data-engineering-zoomcamp,a1daf537
Are there any exceptions to the policy against late homework submissions?,data-engineering-zoomcamp,be5bfee4
What happens if the homework form is still open after the due date?,data-engineering-zoomcamp,be5bfee4
How can I verify my homework submission after submitting it late?,data-engineering-zoomcamp,be5bfee4
Is it possible to submit homework after the deadline?,data-engineering-zoomcamp,be5bfee4
Where can I find more information about the homework submission policy?,data-engineering-zoomcamp,be5bfee4
What is the URL for homework submissions?,data-engineering-zoomcamp,0e424a44
Where should I store my homework code?,data-engineering-zoomcamp,0e424a44
How can I locate my homework repository?,data-engineering-zoomcamp,0e424a44
What does the homework link refer to?,data-engineering-zoomcamp,0e424a44
Where should I upload my course exercises?,data-engineering-zoomcamp,0e424a44
How are homework points determined in the course management platform?,data-engineering-zoomcamp,29865466
Where can I see the total points I have accumulated in the course?,data-engineering-zoomcamp,29865466
What activities contribute points to the leaderboard?,data-engineering-zoomcamp,29865466
How many points do I receive for submitting something to the FAQ?,data-engineering-zoomcamp,29865466
What is the point allocation for learning in public in this course?,data-engineering-zoomcamp,29865466
How can I determine my random name on the leaderboard?,data-engineering-zoomcamp,016d46a1
Where can I find my display name in my course account settings?,data-engineering-zoomcamp,016d46a1
What steps do I need to follow to locate my leaderboard alias?,data-engineering-zoomcamp,016d46a1
How do I change my display name for the course leaderboard?,data-engineering-zoomcamp,016d46a1
Which link do I need to access to find my display name in the course profile?,data-engineering-zoomcamp,016d46a1
What is the recommended version of Python to use for the course in 2024?,data-engineering-zoomcamp,47972cb1
Is Python 3.10 a viable version for the course?,data-engineering-zoomcamp,47972cb1
Can I expect Python 3.11 to work effectively with the course materials?,data-engineering-zoomcamp,47972cb1
Is the recommendation to use Python 3.9 based on ease of troubleshooting?,data-engineering-zoomcamp,47972cb1
Does the decision to suggest Python 3.9 relate to course video recordings?,data-engineering-zoomcamp,47972cb1
"As a Windows user, will I encounter challenges when setting up the environment on my local machine?",data-engineering-zoomcamp,ddf6c1b3
Which step should I start with if I want to use a virtual machine for my course environment?,data-engineering-zoomcamp,ddf6c1b3
Why might someone choose to use GitHub Codespaces instead of their local machine for this course?,data-engineering-zoomcamp,ddf6c1b3
Is there a specific week I should begin with if I'm setting up my environment locally on a laptop?,data-engineering-zoomcamp,ddf6c1b3
What are some benefits of setting up a virtual machine for different work locations?,data-engineering-zoomcamp,ddf6c1b3
Does GitHub Codespaces provide alternative computing resources for data ingestion and Docker file creation?,data-engineering-zoomcamp,ac25d3af
Are there pre-installed tools like Docker in GitHub Codespaces?,data-engineering-zoomcamp,ac25d3af
Can I open repositories directly in GitHub Codespaces using its resources?,data-engineering-zoomcamp,ac25d3af
What resources does GitHub Codespaces offer for someone who wants to skip using cli/git bash?,data-engineering-zoomcamp,ac25d3af
Is Python available as a pre-installed tool in GitHub Codespaces for course projects?,data-engineering-zoomcamp,ac25d3af
Is it mandatory to utilize GitHub Codespaces for this course?,data-engineering-zoomcamp,251218fc
Can I use my existing setup with PostgreSQL and Docker for the course?,data-engineering-zoomcamp,251218fc
Are there any alternatives to GitHub Codespaces for completing the course?,data-engineering-zoomcamp,251218fc
Do I have the flexibility to run the course environment on my personal computer?,data-engineering-zoomcamp,251218fc
"Is a cloud-based environment necessary for the coursework, or can local solutions suffice?",data-engineering-zoomcamp,251218fc
Do I need to use both GitHub Codespaces and Google Cloud Platform for the course?,data-engineering-zoomcamp,3c0114ce
Which platform should I choose for my final project environment setup?,data-engineering-zoomcamp,3c0114ce
Is BigQuery essential to learn for this course?,data-engineering-zoomcamp,3c0114ce
Can I set up a local environment instead of using online platforms?,data-engineering-zoomcamp,3c0114ce
Is it necessary to use both GitHub Codespaces and GCP for completing the course tasks?,data-engineering-zoomcamp,3c0114ce
How can I open the Run command window on a Windows machine?,data-engineering-zoomcamp,f43f5fe7
What is the method to access the Registry Editor on Windows?,data-engineering-zoomcamp,f43f5fe7
Which registry values need to be changed to resolve connection issues with GCP VM?,data-engineering-zoomcamp,f43f5fe7
Where can I find the known_hosts file on a Windows machine?,data-engineering-zoomcamp,f43f5fe7
What is an alternative solution to changing registry values for connecting to GCP VM using VSCode?,data-engineering-zoomcamp,f43f5fe7
Why is GCP selected for our course over other cloud services?,data-engineering-zoomcamp,d061525d
Is it possible to use AWS or Azure in place of GCP for this course?,data-engineering-zoomcamp,d061525d
Does GCP offer any incentives for new users?,data-engineering-zoomcamp,d061525d
What is required to sign up for a free GCP account?,data-engineering-zoomcamp,d061525d
How does BigQuery relate to the choice of GCP in our course?,data-engineering-zoomcamp,d061525d
Is there a cost for utilizing cloud services during the course?,data-engineering-zoomcamp,1cd01b2c
Are there any free trials available for cloud platforms in this course?,data-engineering-zoomcamp,1cd01b2c
"When using GCP, do I need to incur any costs for services?",data-engineering-zoomcamp,1cd01b2c
Can I access GCP services without payment while studying?,data-engineering-zoomcamp,1cd01b2c
Is it necessary to pay for any platform if using GCP during the course?,data-engineering-zoomcamp,1cd01b2c
Is there a way to complete the course without accessing GCP or other cloud providers?,data-engineering-zoomcamp,e4a7c3b0
Can I run the course materials locally if cloud services are restricted in my area?,data-engineering-zoomcamp,e4a7c3b0
What should I do if I cannot access BigQuery due to regional restrictions?,data-engineering-zoomcamp,e4a7c3b0
Are there local alternatives for all the tools used in the course?,data-engineering-zoomcamp,e4a7c3b0
Will you provide guides for setting up the course environment at home?,data-engineering-zoomcamp,e4a7c3b0
Can I use AWS instead of the recommended environment for the course projects?,data-engineering-zoomcamp,7cd1912e
What challenges might I encounter if I choose to use AWS for the course?,data-engineering-zoomcamp,7cd1912e
Will using AWS affect the evaluation of the final capstone project?,data-engineering-zoomcamp,7cd1912e
Who can I turn to for help if I use AWS during the course?,data-engineering-zoomcamp,7cd1912e
Is it feasible to adapt course materials meant for a different platform to AWS?,data-engineering-zoomcamp,7cd1912e
When can I expect additional live calls outside of office hours?,data-engineering-zoomcamp,52393fb3
Will there be any scheduled live sessions during the Capstone period?,data-engineering-zoomcamp,52393fb3
Are live zoom calls planned apart from regular office hours?,data-engineering-zoomcamp,52393fb3
How will we be informed about any live calls during the Capstone project?,data-engineering-zoomcamp,52393fb3
Is there a possibility of having extra live calls to address queries during Capstone?,data-engineering-zoomcamp,52393fb3
Are we utilizing the data from the previous year's project for our current assignment?,data-engineering-zoomcamp,10515af5
Is the NYC Trip dataset from January 2021 still being used for the project this year?,data-engineering-zoomcamp,10515af5
"Has the project assignment changed, or are we repeating last year's work with the same data?",data-engineering-zoomcamp,10515af5
"Will we switch to the NYC Trip data for January 2022, or continue with 2021's dataset?",data-engineering-zoomcamp,10515af5
Is the dataset for our project still accessible at the same location as before?,data-engineering-zoomcamp,10515af5
What happened to the 2022 repository?,data-engineering-zoomcamp,cdb86a97
Is the 2022 content still accessible?,data-engineering-zoomcamp,cdb86a97
Did you relocate the materials from 2022?,data-engineering-zoomcamp,cdb86a97
Where can I find the resources from 2022?,data-engineering-zoomcamp,cdb86a97
Was the old 2022 repository removed from view?,data-engineering-zoomcamp,cdb86a97
Is it possible to choose any tool for the final project?,data-engineering-zoomcamp,3e0114ad
Am I allowed to use tools other than the recommended ones for my project?,data-engineering-zoomcamp,3e0114ad
Can I select my preferred software to complete the final project?,data-engineering-zoomcamp,3e0114ad
Is it acceptable to utilize different applications for the final assignment?,data-engineering-zoomcamp,3e0114ad
Do I have the freedom to use any technology for my course project?,data-engineering-zoomcamp,3e0114ad
Can I use Airflow or Prefect instead of Mage for the course assignments?,data-engineering-zoomcamp,b2799574
Is it acceptable to use AWS products in place of GCP products during the course?,data-engineering-zoomcamp,b2799574
Am I allowed to use Tableau instead of Metabase or Google Data Studio for the course tasks?,data-engineering-zoomcamp,b2799574
What options do I have for using alternative data stacks in this course?,data-engineering-zoomcamp,b2799574
Will support be provided if I choose a different tool set from what is covered in the course?,data-engineering-zoomcamp,b2799574
How can I share and support this course?,data-engineering-zoomcamp,2f19301f
What should I do if I have ideas to improve the course material?,data-engineering-zoomcamp,2f19301f
How can I help make our course more well-known among peers?,data-engineering-zoomcamp,2f19301f
What actions can I take if I notice any improvements to be made?,data-engineering-zoomcamp,2f19301f
How can I offer my contributions to this course repository?,data-engineering-zoomcamp,2f19301f
Does the class work well on Mac?,data-engineering-zoomcamp,7c700adb
Is Windows a suitable option for your course?,data-engineering-zoomcamp,7c700adb
Can the program run on Linux?,data-engineering-zoomcamp,7c700adb
Which OS was used by attendees in the past?,data-engineering-zoomcamp,7c700adb
Are all operating systems supported for this course?,data-engineering-zoomcamp,7c700adb
What challenges do Windows users face when working with modules that include *.sh shell scripts?,data-engineering-zoomcamp,44b14808
Why is the WSL environment setup recommended for Windows users from the beginning of the course?,data-engineering-zoomcamp,44b14808
How did previous cohorts manage to get past the difficulties related to *.sh scripts on Windows?,data-engineering-zoomcamp,44b14808
What modules specifically use shell scripts that cause issues for Windows users?,data-engineering-zoomcamp,44b14808
Why might git bash or MINGW64 not be sufficient for running *.sh files on Windows?,data-engineering-zoomcamp,44b14808
What are some recommended books for this course?,data-engineering-zoomcamp,76e4baf6
Can you suggest any additional resources to help with the course?,data-engineering-zoomcamp,76e4baf6
Where can I find a list of further reading materials for the course?,data-engineering-zoomcamp,76e4baf6
Are there any books or resources you suggest for better understanding the material?,data-engineering-zoomcamp,76e4baf6
Is there a document listing recommended books and resources for this course?,data-engineering-zoomcamp,76e4baf6
What happens if I miss the first project deadline?,data-engineering-zoomcamp,48b533a8
Is it possible to redo the project if I fail the first time?,data-engineering-zoomcamp,48b533a8
How many opportunities do I have to complete the project?,data-engineering-zoomcamp,48b533a8
Can I submit the project late on the first attempt?,data-engineering-zoomcamp,48b533a8
What are the consequences of failing the initial project attempt?,data-engineering-zoomcamp,48b533a8
What is the first step in resolving technical issues during the course?,data-engineering-zoomcamp,954044d1
What should I include when asking a question about an error I encountered?,data-engineering-zoomcamp,954044d1
Why should I avoid using screenshots when seeking help for a course-related problem?,data-engineering-zoomcamp,954044d1
What strategies can I use if I hit a roadblock and can’t solve an issue immediately?,data-engineering-zoomcamp,954044d1
How can I effectively search for solutions to a problem I encounter in the course?,data-engineering-zoomcamp,954044d1
When should I ask for help according to the troubleshooting guide?,data-engineering-zoomcamp,a820b9b3
What details should I include about my coding environment when asking a question?,data-engineering-zoomcamp,a820b9b3
How should I describe the steps I followed when asking for help?,data-engineering-zoomcamp,a820b9b3
What specific error-related information should I provide when asking a question?,data-engineering-zoomcamp,a820b9b3
Why is it important to mention unsuccessful attempts when seeking help?,data-engineering-zoomcamp,a820b9b3
What steps should I follow to clone the course repo to my local machine?,data-engineering-zoomcamp,f2945cd2
How can I manage my own notes and file versions for the course using GitHub?,data-engineering-zoomcamp,f2945cd2
What should I remember to exclude from my Git repositories?,data-engineering-zoomcamp,f2945cd2
Where can I find a tutorial on setting up a Git repository?,data-engineering-zoomcamp,f2945cd2
Why should I never store passwords or keys in a Git repository?,data-engineering-zoomcamp,f2945cd2
What error occurs when spaces are used instead of tabs in a Makefile?,data-engineering-zoomcamp,eb9d376f
How can a 'missing separator' issue in a Makefile be resolved?,data-engineering-zoomcamp,eb9d376f
What is the solution if Makefile errors out with '*** missing separator. Stop.'?,data-engineering-zoomcamp,eb9d376f
What should be done to fix a Makefile tab error?,data-engineering-zoomcamp,eb9d376f
When should spaces be converted to tabs in a Makefile?,data-engineering-zoomcamp,eb9d376f
How can I open HTML files with a Windows browser while using Linux on WSL 2?,data-engineering-zoomcamp,72f25f6d
What tool do I need to install to view HTML files from Linux on WSL in a Windows browser?,data-engineering-zoomcamp,72f25f6d
How should I customize the browser used for opening HTML files on Linux in WSL?,data-engineering-zoomcamp,72f25f6d
How do I use wslview to open a page like index.html from Linux on WSL?,data-engineering-zoomcamp,72f25f6d
Which environment variable do I need to set to choose a specific browser in WSL?,data-engineering-zoomcamp,72f25f6d
How do I configure Chrome Remote Desktop on a Debian Linux VM in the Compute Engine?,data-engineering-zoomcamp,a1e59afc
What should I do if I encounter a 403 Forbidden error while downloading 2021 Yellow Taxi Trip Records?,data-engineering-zoomcamp,a1e59afc
Where can I find a backup link for the 2021 Yellow Taxi Trip Records if I can't download it from the TLC website?,data-engineering-zoomcamp,a1e59afc
Which command should be used to unzip a .gz file when the 'unzip' command fails?,data-engineering-zoomcamp,a1e59afc
What type of error might you face when downloading Yellow Taxi Trip Records from the TLC website?,data-engineering-zoomcamp,a1e59afc
How should taxi data files be handled if they are available as *.csv.gz instead of csv?,data-engineering-zoomcamp,71c10610
What should be done to store the taxi data correctly when the file extension is csv.gz?,data-engineering-zoomcamp,71c10610
How can we determine the appropriate csv_name for storing the taxi data file?,data-engineering-zoomcamp,71c10610
What adjustments are necessary for using pd.read_csv with a taxi data file that has a csv.gz extension?,data-engineering-zoomcamp,71c10610
Why is it important to replace csv_name with the file name from the URL when handling taxi data files?,data-engineering-zoomcamp,71c10610
Where can I find the data dictionary for yellow taxi trips in NY?,data-engineering-zoomcamp,17a5aea1
Is there a link available for the data dictionary of green taxi trips in New York?,data-engineering-zoomcamp,17a5aea1
Could you direct me to the online resource for the yellow taxi trip records data dictionary?,data-engineering-zoomcamp,17a5aea1
Can you provide the URL for the data dictionary for green taxi data in NY?,data-engineering-zoomcamp,17a5aea1
What is the online address to access the data dictionary for yellow taxi trips?,data-engineering-zoomcamp,17a5aea1
How do you unzip a parquet file downloaded in the context of module 1 on Docker and Terraform?,data-engineering-zoomcamp,5a275db7
What command line tool is used to unzip a file as shown in Module 1's taxi data section?,data-engineering-zoomcamp,5a275db7
How can you use a parquet file directly within the ingest_data.py Python script?,data-engineering-zoomcamp,5a275db7
What line should be added to def main(params) to use a parquet file directly in a Python script?,data-engineering-zoomcamp,5a275db7
What two-step process is suggested for converting a downloaded .parquet file to a CSV using pandas?,data-engineering-zoomcamp,5a275db7
What steps should I follow to resolve 'wget is not recognized as an internal or external command' on Ubuntu?,data-engineering-zoomcamp,7ec0f9b0
How can I install wget on MacOS if I encounter the error 'wget is not recognized as an internal or external command'?,data-engineering-zoomcamp,7ec0f9b0
What options are available for installing wget on a Windows machine?,data-engineering-zoomcamp,7ec0f9b0
How can I use the Python wget library if the wget command is not available in my system?,data-engineering-zoomcamp,7ec0f9b0
