question,course,document
How can I fix the out of bounds timestamp error when using pandas to read NYC gov parquet files?,data-engineering-zoomcamp,a4ba2478
Can pyarrow help prevent out of bounds timestamp errors in parquet files from nyc.gov?,data-engineering-zoomcamp,a4ba2478
What is the role of the 'errors=coerce' parameter when converting out of bounds datetime columns in parquet files?,data-engineering-zoomcamp,a4ba2478
What is causing the error when reading the table trips_data_all.external_fhv_tripdata?,data-engineering-zoomcamp,74c361fe
"For homework 3, do I need to download all 12 parquet files for the 2022 green taxi data?",data-engineering-zoomcamp,74c361fe
How should I organize the NYC taxi data parquet files in my GCS bucket for the 2022 green taxi data?,data-engineering-zoomcamp,74c361fe
What wildcard character can I use to refer to all 12 2022 NYC taxi data files in a single URI?,data-engineering-zoomcamp,74c361fe
How should I handle type mismatches when creating an external table in BigQuery with parquet files?,data-engineering-zoomcamp,74c361fe
What should I do if I encounter a Parquet column type mismatch error in my data?,data-engineering-zoomcamp,b9b3ef9f
How can I avoid schema issues when working on my homework?,data-engineering-zoomcamp,b9b3ef9f
Is there a way to upload multiple files to GCS simultaneously using the GUI?,data-engineering-zoomcamp,b9b3ef9f
Can I upload an entire folder to Google Cloud Storage using the interface?,data-engineering-zoomcamp,b9b3ef9f
What steps should I follow to upload files to GCS and prevent Parquet column errors?,data-engineering-zoomcamp,b9b3ef9f
questions,data-engineering-zoomcamp,009ac612
What should I do if there is an error while reading the table concerning the Parquet column 'DOlocationID'?,data-engineering-zoomcamp,68815ec2
Is it common for students not to get an exact match for Question 6 of the Module 3 homework?,data-engineering-zoomcamp,68815ec2
"What should I do if my answer for Module 3, Question 6 is very close but not an exact match?",data-engineering-zoomcamp,68815ec2
Why might I be encountering a data type error involving INT64 and DOUBLE when reading a table?,data-engineering-zoomcamp,68815ec2
Did anyone manage to get an exact match for the options provided in Module 3 homework Question 6?,data-engineering-zoomcamp,68815ec2
What should I do if I see an error that states the Parquet column type doesn't match the target type?,data-engineering-zoomcamp,c8ad08b3
How can I resolve the 'unicodedecodeerror' when reading a csv in Python?,data-engineering-zoomcamp,c8ad08b3
What's the correct encoding to use when reading data from the web into a pandas dataframe to avoid an 'invalid start byte' error?,data-engineering-zoomcamp,c8ad08b3
How do I write a dataframe to Google Cloud Storage as a csv with the proper encoding?,data-engineering-zoomcamp,c8ad08b3
Is there an alternative to using pd.read_csv to avoid encoding issues?,data-engineering-zoomcamp,c8ad08b3
What is a generator in Python and how does it differ from a list or tuple?,data-engineering-zoomcamp,d68b433f
Why are generators considered memory-efficient in Python?,data-engineering-zoomcamp,d68b433f
How does a generator return values in Python?,data-engineering-zoomcamp,d68b433f
What keyword is used in Python to make a function a generator?,data-engineering-zoomcamp,d68b433f
In what scenarios are Python generators particularly useful?,data-engineering-zoomcamp,d68b433f
What does the error regarding Parquet column 'DOlocationID' indicate?,data-engineering-zoomcamp,e265ee5a
How can I resolve the Parquet type mismatch issue in my data table?,data-engineering-zoomcamp,e265ee5a
What function in Python allows reading multiple files together?,data-engineering-zoomcamp,e265ee5a
Is it possible to combine several files into a single result using a specific function?,data-engineering-zoomcamp,e265ee5a
What argument type does read_parquet accept to merge files?,data-engineering-zoomcamp,e265ee5a
What is the error when reading the table trips_data_all.external_fhv_tripdata?,data-engineering-zoomcamp,0e7dfddc
How should DOlocationID be formatted to avoid the Parquet error?,data-engineering-zoomcamp,0e7dfddc
What is the incorrect way to handle the DOlocationID in the DataFrame?,data-engineering-zoomcamp,0e7dfddc
What is the correct method to ensure DOlocationID is the right type?,data-engineering-zoomcamp,0e7dfddc
Why doesn't the 'astype(int)' conversion work for DOlocationID in this context?,data-engineering-zoomcamp,0e7dfddc
What causes the error when running my Prefect Flow to load data to GCS?,data-engineering-zoomcamp,0a059700
What should I do if my Prefect flow returns a ValueError related to a nonexistent path?,data-engineering-zoomcamp,0a059700
How can I fix the error related to the Parquet column 'DOlocationID' type mismatch?,data-engineering-zoomcamp,0a059700
Why might the 'cache_key_fn=task_input_hash' argument cause an error during my Prefect flow?,data-engineering-zoomcamp,0a059700
What is the benefit of using a cache key function when running code multiple times?,data-engineering-zoomcamp,0a059700
What is a sample snippet for downloading a csv.gz file from a URL using Prefect in the context of analytics engineering with dbt?,data-engineering-zoomcamp,feca7402
How do I define a task in Prefect to download a file from a given URL?,data-engineering-zoomcamp,feca7402
What is the function of the extract_from_web() flow in the sample Prefect code?,data-engineering-zoomcamp,feca7402
How can I specify the file path when downloading a csv.gz file in Prefect?,data-engineering-zoomcamp,feca7402
"In Prefect, how can the response from a URL be written to a file during analytics engineering with dbt?",data-engineering-zoomcamp,feca7402
What should I update if I receive a 'not found in location us' error when using dbt?,data-engineering-zoomcamp,1f519b1a
How can I resolve the DBT Cloud production error related to the dataset location being in the EU instead of the US?,data-engineering-zoomcamp,1f519b1a
What is the issue if everything works in development mode but fails when scheduling a production job in dbt?,data-engineering-zoomcamp,1f519b1a
What is a potential solution for the 'ERROR 404: project.dataset:prod not available in location EU' in dbt?,data-engineering-zoomcamp,1f519b1a
Is recreating my dbt project or buckets in the US the only solution for location-related errors in production?,data-engineering-zoomcamp,1f519b1a
What should I do if I encounter an error stating that there is no development environment configured in the dbt project?,data-engineering-zoomcamp,43c454c7
Where can I find guidance on setting up a development environment for dbt?,data-engineering-zoomcamp,43c454c7
What message appears when a development environment is not configured in a dbt project?,data-engineering-zoomcamp,43c454c7
How does the error message help in resolving the issue of a missing development environment in dbt?,data-engineering-zoomcamp,43c454c7
In which resources can I find more information if I receive a 'no development environment' error in dbt?,data-engineering-zoomcamp,43c454c7
questions,data-engineering-zoomcamp,d7ad69da
What should I check if a dbt Cloud run was cancelled?,data-engineering-zoomcamp,03fdb780
Why wasn't a valid dbt project found during my run?,data-engineering-zoomcamp,03fdb780
How can I fix a cancelled dbt build error related to project configuration?,data-engineering-zoomcamp,03fdb780
Where do I specify the location if my dbt project is in a subdirectory?,data-engineering-zoomcamp,03fdb780
What file needs to exist to avoid a dbt Cloud cancellation error?,data-engineering-zoomcamp,03fdb780
What should I do if I encounter a 'Permission denied' error while cloning a repository for Module 4?,data-engineering-zoomcamp,9c85f3aa
How can I proceed if cloning the 'data-engineering-zoomcamp.git' repository fails due to remote read issues?,data-engineering-zoomcamp,9c85f3aa
"If I don't have permissions to write to the DataTalksClub repository, what are my options?",data-engineering-zoomcamp,9c85f3aa
Can you suggest a solution if using 'git clone' results in a public key permission error with GitHub?,data-engineering-zoomcamp,9c85f3aa
Is there an alternative method to clone the repository if I can't use the SSH link?,data-engineering-zoomcamp,9c85f3aa
What should I do if the 'Triggered by pull requests' option is disabled when creating a Continuous Integration job in dbt cloud?,data-engineering-zoomcamp,63026349
Can I set up a CI Job in dbt Cloud if I'm on the Developer Plan?,data-engineering-zoomcamp,63026349
Why might the 'Triggered by pull requests' option remain disabled even if I am on the Team Plan trial period?,data-engineering-zoomcamp,63026349
Do I need to be on a specific plan to use CI Jobs in dbt Cloud?,data-engineering-zoomcamp,63026349
Is there a prerequisite plan needed to utilize Continuous Integration Jobs in dbt Cloud?,data-engineering-zoomcamp,63026349
What should I do if the DBT cloud IDE doesn't load and shows an error?,data-engineering-zoomcamp,6ba02f77
How can I resolve an IDE session that fails to start in DBT Cloud?,data-engineering-zoomcamp,6ba02f77
What steps are involved if the DBT Cloud IDE loads indefinitely?,data-engineering-zoomcamp,6ba02f77
Where can I find instructions for setting up SSH keys to resolve IDE issues?,data-engineering-zoomcamp,6ba02f77
How do I import a repo into a DBT project when the IDE fails to start?,data-engineering-zoomcamp,6ba02f77
What should I do if I encounter issues with column datatypes when converting from CSV to Parquet in DBT/BigQuery?,data-engineering-zoomcamp,8b14286c
How can I modify the web_to_gcp pipeline to work with gz files without causing disk space issues?,data-engineering-zoomcamp,8b14286c
"What are the possible solutions for the parquet column error ""ehail_fee"" type mismatch in DBT?",data-engineering-zoomcamp,8b14286c
How can I handle varying parquet file data types using pandas while importing from CSV?,data-engineering-zoomcamp,8b14286c
What data type should be used in pandas to handle null values for integer columns?,data-engineering-zoomcamp,8b14286c
What should I do if I get an 'Access Denied' error from the S3 bucket while trying to load trip data into GCS using the quick script?,data-engineering-zoomcamp,14a876ea
How can I download trip data if the provided S3 URL is not working?,data-engineering-zoomcamp,14a876ea
Where can I find the CLI instructions to download trip data from GitHub?,data-engineering-zoomcamp,14a876ea
What are the commands needed to use the GitHub CLI for accessing trip data for the dbt course?,data-engineering-zoomcamp,14a876ea
"After obtaining the trip data files, how can I upload them to a GCS bucket?",data-engineering-zoomcamp,14a876ea
"In Module 4, what issue arises during the conversion of fhv_tripdata_2020-01.csv using Airflow?",data-engineering-zoomcamp,1cf5be74
How do random line breaks affect the format_to_parquet_task when processing fhv data?,data-engineering-zoomcamp,1cf5be74
What is the specific error message received when converting fhv_tripdata_2020-01.csv?,data-engineering-zoomcamp,1cf5be74
What command can be used to fix broken lines in fhv_tripdata_2020-01.csv in Apache Airflow?,data-engineering-zoomcamp,1cf5be74
"In the context of Module 4, how can one enforce the re-execution of a failed task in Airflow after fixing line breaks?",data-engineering-zoomcamp,1cf5be74
What was the problem encountered when using the initial method to load yellow trip data to GCS?,data-engineering-zoomcamp,315ac3cc
How did downloading and uploading parquet files directly to GCS impact the loading process?,data-engineering-zoomcamp,315ac3cc
What issue arose when creating the BigQuery table after using parquet files for loading data?,data-engineering-zoomcamp,315ac3cc
Where can I find an alternative hack for loading yellow and green trip data?,data-engineering-zoomcamp,315ac3cc
Who suggested the successful hack shared in slack for loading data to BigQuery in Week 4?,data-engineering-zoomcamp,315ac3cc
How do I move multiple files from a Google Cloud Storage bucket to BigQuery?,data-engineering-zoomcamp,c5c3beba
What should I add in the destination folder when moving many files from Google Cloud Storage to BigQuery?,data-engineering-zoomcamp,c5c3beba
What is the correct path format for transferring several files to BigQuery from Google Cloud?,data-engineering-zoomcamp,c5c3beba
What needs to be specified in the destination when transferring multiple files from Google Storage to BigQuery?,data-engineering-zoomcamp,c5c3beba
How is the destination path set when moving files from Google Cloud Storage bucket to BigQuery?,data-engineering-zoomcamp,c5c3beba
Why does the SSH not work on my VM after restart in Module 4?,data-engineering-zoomcamp,f19be91b
What is a potential cause for loss of space when using prefect in Module 4?,data-engineering-zoomcamp,f19be91b
How can I solve SSH issues due to disk space after running prefect in Module 4?,data-engineering-zoomcamp,f19be91b
Where can I find the folder to clear Prefect logs in Module 4 to fix SSH issues?,data-engineering-zoomcamp,f19be91b
How often should I delete logs in Module 4 to maintain enough space for SSH in my VM?,data-engineering-zoomcamp,f19be91b
questions,data-engineering-zoomcamp,33db7dc7
How can I resolve a '404 Not found' error for dataset eighth-zenith-372015:trip_data_all?,data-engineering-zoomcamp,67ef8f87
Why might there be a mismatch in dataset locations in BigQuery when using dbt?,data-engineering-zoomcamp,67ef8f87
What steps should I follow in DBT cloud to update the dataset location?,data-engineering-zoomcamp,67ef8f87
Is it possible to specify a single-region location for datasets in BigQuery?,data-engineering-zoomcamp,67ef8f87
What should I do if the source dataset and schema have different locations in BigQuery?,data-engineering-zoomcamp,67ef8f87
What should be done if a warning occurs after executing dbt run with dbt-utils version 1.0.0?,data-engineering-zoomcamp,6acf2e77
What replacement is needed for dbt_utils.surrogate_key in stg_green_tripdata.sql?,data-engineering-zoomcamp,6acf2e77
How can the error 'Access Denied: BigQuery BigQuery: Permission denied while globbing file pattern' during dbt run be resolved?,data-engineering-zoomcamp,6acf2e77
Which role must be added to the service account in BigQuery to fix the 'Access Denied' error?,data-engineering-zoomcamp,6acf2e77
What related roles should be added to the service account in GCS to address permission issues?,data-engineering-zoomcamp,6acf2e77
What steps should I take when I encounter a missing dbt_utils error?,data-engineering-zoomcamp,18430f10
How do I resolve the issue of dbt_utils not found?,data-engineering-zoomcamp,18430f10
What file creation is necessary for fixing dbt_utils errors?,data-engineering-zoomcamp,18430f10
What version of dbt_utils should I specify to fix the error?,data-engineering-zoomcamp,18430f10
What command should I execute after making changes to packages.yml for dbt_utils?,data-engineering-zoomcamp,18430f10
How can I fix errors if lineage is unavailable in my dbt project?,data-engineering-zoomcamp,afb7a40a
What should I check if lineage is showing unavailable due to compilation errors?,data-engineering-zoomcamp,afb7a40a
How do I ensure proper formatting of the yml file to resolve lineage issues?,data-engineering-zoomcamp,afb7a40a
Where can I find the logs to verify if my dbt run was successful?,data-engineering-zoomcamp,afb7a40a
How can I access and analyze error messages or warnings from the command history console in dbt?,data-engineering-zoomcamp,afb7a40a
How can I resolve my Fact_trips containing only a few days of data in the build process?,data-engineering-zoomcamp,d6a5b80e
What command should I use to ensure all data is included in Fact_trips?,data-engineering-zoomcamp,d6a5b80e
Why might my Fact_trips data be limited to a few days?,data-engineering-zoomcamp,d6a5b80e
What should I do if my Fact_trips build only shows a few days of data?,data-engineering-zoomcamp,d6a5b80e
How can I check if I'm correctly setting 'is_test_run' to false in my dbt commands?,data-engineering-zoomcamp,d6a5b80e
What step might result in my fact_trips table only having data for one month?,data-engineering-zoomcamp,de426d2f
How can I ensure all months of 2019 and 2020 data are included in my BigQuery table?,data-engineering-zoomcamp,de426d2f
What should be considered when writing monthly data from GCS to BigQuery to avoid overwriting?,data-engineering-zoomcamp,de426d2f
Why would using if_exists='replace' in my automated workflow lead to incomplete data in BigQuery?,data-engineering-zoomcamp,de426d2f
What change should be made in the flow setup to append all month data instead of replacing it?,data-engineering-zoomcamp,de426d2f
What change should I make when BigQuery errors on the dm_monthly_zone_revenue.sql model?,data-engineering-zoomcamp,354f0e10
How do I correct the month truncation in the dm_monthly_zone_revenue.sql model when using dbt?,data-engineering-zoomcamp,354f0e10
What modification is needed for date_trunc in the BigQuery model dm_monthly_zone_revenue.sql?,data-engineering-zoomcamp,354f0e10
How can I fix the date_trunc function error in the dm_monthly_zone_revenue.sql model?,data-engineering-zoomcamp,354f0e10
What is the correct syntax for the date_trunc function in the dm_monthly_zone_revenue.sql model?,data-engineering-zoomcamp,354f0e10
What function should be used to replace dbt_utils.surrogate_key?,data-engineering-zoomcamp,98fae8d0
Which dbt_utils function should generate a surrogate key?,data-engineering-zoomcamp,98fae8d0
How can I generate a surrogate key using dbt_utils?,data-engineering-zoomcamp,98fae8d0
What is the alternative to dbt_utils.surrogate_key?,data-engineering-zoomcamp,98fae8d0
Which function replaces dbt_utils.surrogate_key in the code?,data-engineering-zoomcamp,98fae8d0
What should I do if dbt run errors after I change location?,data-engineering-zoomcamp,cb678fde
How can I resolve an error caused by a location change in dbt?,data-engineering-zoomcamp,cb678fde
Why is dbt run failing after I modified the location?,data-engineering-zoomcamp,cb678fde
What step is needed if dbt run fails due to location change?,data-engineering-zoomcamp,cb678fde
How to fix a dbt run error after changing the BigQuery location?,data-engineering-zoomcamp,cb678fde
What should I do if my table in BigQuery doesn't update after running dbt with a variable specified?,data-engineering-zoomcamp,39bfb043
How can I prevent dbt from creating a new dataset in BigQuery when running my CI/CD Job?,data-engineering-zoomcamp,39bfb043
Why might dbt create a new environment in BigQuery instead of merging dev models into production?,data-engineering-zoomcamp,39bfb043
What setting should be adjusted in the CI/CD job configuration to avoid new datasets in BigQuery?,data-engineering-zoomcamp,39bfb043
What is the impact of selecting 'No; do not defer to another environment' in the CI/CD job setup with dbt?,data-engineering-zoomcamp,39bfb043
What purpose does the Staging dataset serve in analytics engineering?,data-engineering-zoomcamp,351a078a
Why are the datasets in the staging area materialized as views instead of tables?,data-engineering-zoomcamp,351a078a
Is the Staging dataset required in Vic's project setup?,data-engineering-zoomcamp,351a078a
How does the Staging dataset relate to the raw dataset and the fact and dim tables?,data-engineering-zoomcamp,351a078a
"Why were only the production and dbt_name datasets necessary, not the Staging dataset?",data-engineering-zoomcamp,351a078a
How can I access DBT docs if they are not opening in my browser?,data-engineering-zoomcamp,61da1919
What should I try if the DBT docs are served but I can’t view them in my browser?,data-engineering-zoomcamp,61da1919
"If my DBT documentation isn't accessible through a browser, what modification should I make?",data-engineering-zoomcamp,61da1919
What step can resolve my issue of not accessing DBT docs via the browser?,data-engineering-zoomcamp,61da1919
Which line should I remove from docker-compose to fix browser access to DBT docs?,data-engineering-zoomcamp,61da1919
Where do I type in the GCP location to resolve the 404 error when the dataset wasn't found in BigQuery?,data-engineering-zoomcamp,6528c6ae
What are the steps required to fix the issue of a missing dataset location in BigQuery for dbt?,data-engineering-zoomcamp,6528c6ae
How can I ensure my BigQuery dataset is created in the correct location to avoid a 404 error?,data-engineering-zoomcamp,6528c6ae
What should I do if my BigQuery adapter provides a 404 error regarding a missing dataset in europe-west6?,data-engineering-zoomcamp,6528c6ae
What actions are necessary if my Google Cloud Platform key needs to be reuploaded due to a dataset not being found?,data-engineering-zoomcamp,6528c6ae
How do I make changes if the main branch is set to read-only in dbt+git?,data-engineering-zoomcamp,c0d3a2e8
What should I do to edit if the main branch cannot be changed in dbt+git?,data-engineering-zoomcamp,c0d3a2e8
What's the process for editing when the read-only restriction applies to the main branch in dbt?,data-engineering-zoomcamp,c0d3a2e8
"If I can't edit the main branch in dbt, what is the alternative?",data-engineering-zoomcamp,c0d3a2e8
Where can I find more information on dealing with a read-only main branch in dbt?,data-engineering-zoomcamp,c0d3a2e8
How can I make changes in my dbt files if I am in read-only mode?,data-engineering-zoomcamp,859a97c5
What is the solution to editing dbt files when they appear read-only?,data-engineering-zoomcamp,859a97c5
I am unable to edit my dbt files because of read-only mode; how can this be resolved?,data-engineering-zoomcamp,859a97c5
What steps should I take to make changes to dbt files if they're in a read-only state?,data-engineering-zoomcamp,859a97c5
How do I proceed with editing dbt files that are currently read-only?,data-engineering-zoomcamp,859a97c5
Why am I unable to create CI checks for deployment to Production using dbt deploy and Git CI?,data-engineering-zoomcamp,32469a2d
How can I fix the error that occurs when CI checks are triggered by pull requests?,data-engineering-zoomcamp,32469a2d
What should I avoid according to the guide on the DTC repo regarding Git setup?,data-engineering-zoomcamp,32469a2d
Is there a solution that involves changing the integration method for dbt repositories?,data-engineering-zoomcamp,32469a2d
Where can I find a step-by-step guide to fix the Git integration issue?,data-engineering-zoomcamp,32469a2d
What should I do if I can't see Run on Pull Requests in the CI configuration with Github?,data-engineering-zoomcamp,c599b3a0
How can I change the connection method to Github for CI configuration in dbt?,data-engineering-zoomcamp,c599b3a0
Where do I disconnect the existing Github configuration in dbt?,data-engineering-zoomcamp,c599b3a0
What permissions need to be allowed when linking my Github account to a dbt project?,data-engineering-zoomcamp,c599b3a0
Where can I find more information about connecting Github with dbt?,data-engineering-zoomcamp,c599b3a0
What should I do if I get a compilation error mentioning a source not found in dbt?,data-engineering-zoomcamp,179df18d
How can I fix the issue when my Lineage graph is not displayed in the dbt video tutorial?,data-engineering-zoomcamp,179df18d
What is a common solution for the dbt compilation error related to 'stg_green_tripdata'?,data-engineering-zoomcamp,179df18d
How do I resolve the lineage graph and compilation error problem in DE Zoomcamp 4.3.1?,data-engineering-zoomcamp,179df18d
What step can I take to fix the compilation error if my schema.yml file seems to cause it?,data-engineering-zoomcamp,179df18d
Why am I getting the 'NoneType' object is not iterable error in Module 4 of analytics engineering with dbt?,data-engineering-zoomcamp,1ce1a275
What should I remember to do when encountering 'NoneType' object is not iterable in dbt?,data-engineering-zoomcamp,1ce1a275
Where is the 'NoneType' object is not iterable error occurring in dbt?,data-engineering-zoomcamp,1ce1a275
Which variable needs to be added to dbt_project.yml to resolve the 'NoneType' object error?,data-engineering-zoomcamp,1ce1a275
Can you tell me the values that should be assigned to payment_type_values in dbt_project.yml to fix the error?,data-engineering-zoomcamp,1ce1a275
Why might I encounter macro errors with get_payment_type_description in Module 4?,data-engineering-zoomcamp,b529b0bc
What do I need to adjust if I copy the dbt macro from the data-engineering-zoomcamp repo and face an error?,data-engineering-zoomcamp,b529b0bc
How should I modify the payment_type data in the macro to avoid a BigQuery BadRequest error?,data-engineering-zoomcamp,b529b0bc
What causes the operator CASE error when using the get_payment_type_description macro?,data-engineering-zoomcamp,b529b0bc
Which data type should be used for numbers in the get_payment_type_description macro?,data-engineering-zoomcamp,b529b0bc
What should I do if I encounter an error in dbt during analytics engineering?,data-engineering-zoomcamp,2e51a111
How can I identify the problematic line in my query when using dbt?,data-engineering-zoomcamp,2e51a111
Where can I find details about a dbt error related to BigQuery?,data-engineering-zoomcamp,2e51a111
What steps should I take to troubleshoot dbt errors effectively?,data-engineering-zoomcamp,2e51a111
How will I know which part of my query is causing an issue in dbt?,data-engineering-zoomcamp,2e51a111
questions,data-engineering-zoomcamp,6e1a0834
What setting allows defining the dbt project root as a subdirectory in GitHub?,data-engineering-zoomcamp,a8657e65
Is there a way to configure the dbt project root to be a specific folder in the repository?,data-engineering-zoomcamp,a8657e65
How can the dbt project root be set to a particular subdirectory in dbt cloud?,data-engineering-zoomcamp,a8657e65
